Class Name	Parent Class	YAML Class Name	Description	Flags	Slot Name	YAML Slot Name	Range	Card	Slot Description	URI
					governmentalIntervention		Bool	0..1	A credit event. A governmental intervention is an event resulting from an action by a governmental authority that materially impacts the reference entity's obligations, such as an interest rate reduction, principal reduction, deferral of interest or principal, change in priority ranking, or change in currency or composition of payment. ISDA 2014 Term: Governmental Intervention.	common_domain_model:governmentalIntervention
					distressedRatingsDowngrade		Bool	0..1	A credit event. Results from the fact that the rating of the reference obligation is down-graded to a distressed rating level. From a usage standpoint, this credit event is typically not applicable in case of RMBS trades.	common_domain_model:distressedRatingsDowngrade
					maturityExtension		Bool	0..1	A credit event. Results from the fact that the underlier fails to make principal payments as expected.	common_domain_model:maturityExtension
					writedown		Bool	0..1	A credit event. Results from the fact that the underlier writes down its outstanding principal amount.	common_domain_model:writedown
					impliedWritedown		Bool	0..1	A credit event. Results from the fact that losses occur to the underlying instruments that do not result in reductions of the outstanding principal of the reference obligation.	common_domain_model:impliedWritedown
					defaultRequirement		Money	0..1	In relation to certain credit events, serves as a threshold for Obligation Acceleration, Obligation Default, Repudiation/Moratorium and Restructuring. Market standard is USD 10,000,000 (JPY 1,000,000,000 for all Japanese Yen trades). This is applied on an aggregate or total basis across all Obligations of the Reference Entity. Used to prevent technical/operational errors from triggering credit events. ISDA 2003 Term: Default Requirement.	common_domain_model:defaultRequirement
					creditEventNotice		CreditEventNotice	0..1	A specified condition to settlement. An irrevocable written or verbal notice that describes a credit event that has occurred. The notice is sent from the notifying party (either the buyer or the seller) to the counterparty. It provides information relevant to determining that a credit event has occurred. This is typically accompanied by Publicly Available Information. ISDA 2003 Term: Credit Event Notice.	common_domain_model:creditEventNotice
CreditIndex	IndexBase	CreditIndex	Specification of an index based on credit risk, typically composed using corporate debt instruments in a region or industry sector, e.g. the iTraxx indices.							
					indexSeries		int	0..1	A CDS index series identifier, e.g. 1, 2, 3 etc.	common_domain_model:indexSeries
					indexAnnexVersion		int	0..1	A CDS index series version identifier, e.g. 1, 2, 3 etc.	common_domain_model:indexAnnexVersion
					indexAnnexDate		XSDDate	0..1	A CDS index series annex date.	common_domain_model:indexAnnexDate
					indexAnnexSource		IndexAnnexSourceEnum	0..1	A CDS index series annex source.	common_domain_model:indexAnnexSource
					excludedReferenceEntity		ReferenceInformation	0..*	Excluded reference entity.	common_domain_model:excludedReferenceEntity
					tranche	CreditIndex_tranche	Tranche	0..1	This element contains CDS tranche terms.	common_domain_model:tranche
					settledEntityMatrix		SettledEntityMatrix	0..1	Used to specify the Relevant Settled Entity Matrix when there are settled entities at the time of the trade.	common_domain_model:settledEntityMatrix
					indexFactor		Decimal	0..1	Index Factor is the index version factor or percent, expressed as an absolute decimal value between 0 and 1, that multiplied by the original notional amount yields the notional amount covered by the seller of protection.	common_domain_model:indexFactor
					seniority	CreditIndex_seniority	CreditSeniorityEnum	0..1	Seniority of debt instruments comprising the index.	common_domain_model:seniority
CreditLimitInformation		CreditLimitInformation	A class to represent the credit limit utilisation information.							
					limitApplicable		LimitApplicableExtended	1..*		common_domain_model:limitApplicable
CreditLimitUtilisation		CreditLimitUtilisation	Credit limit utilisation breakdown by executed trades and pending orders.							
					executed		CreditLimitUtilisationPosition	0..1	Credit limit utilisation attributable to executed trades.	common_domain_model:executed
					pending		CreditLimitUtilisationPosition	0..1	Credit limit utilisation attributable to pending unexecuted orders.	common_domain_model:pending
CreditLimitUtilisationPosition		CreditLimitUtilisationPosition								
					shortPosition		Decimal	0..1	Credit limit utilisation attributable to short positions.	common_domain_model:shortPosition
					longPosition		Decimal	0..1	Credit limit utilisation attributable to long positions.	common_domain_model:longPosition
					global_		Decimal	0..1	Global credit limit utilisation amount, agnostic of long/short position direction.	common_domain_model:global_
CreditNotation		CreditNotation	Represents a class to specify the credit notation as the combination of agency, notation, scale and debt type qualifications.							
					agency		CreditRatingAgencyEnum	1..1	Specifies The credit agency to which the other variables (notation, scale, debt type) refer to.	common_domain_model:agency
					notation		str	1..1	Specifies The credit rating notation. As it varies among credit rating agencies, FpML doesn't specify a default scheme.	common_domain_model:notation
					scale		str	0..1	Specifies the credit rating scale, with a typical distinction between short term, long term. FpML doesn't specify a default scheme, which is hence not specified as an enumeration as part of the CDM.	common_domain_model:scale
					debt		CreditRatingDebt	0..1	Specifies the credit rating debt type (e.g. long term, high yield, deposits, ...) associated with the credit rating notation and scale.	common_domain_model:debt
					outlook		CreditRatingOutlookEnum	0..1	Assesses the potential direction of a long-term credit rating over the intermediate term, which is generally up to two years for investment grade and generally up to one year for speculative grade.	common_domain_model:outlook
					creditWatch		CreditRatingCreditWatchEnum	0..1	Indicates the potential direction of a short-term or long-term rating. It focuses on identifiable events and short-term trends that cause ratings to be placed under special surveillance.	common_domain_model:creditWatch
CreditNotations		CreditNotations	Represents the credit rating notation higher level construct, which provides the ability to specify multiple rating notations.							
					creditNotation		CreditNotation	0..1	Specifies only one credit notation is determined.	common_domain_model:creditNotation
					creditNotations		MultipleCreditNotations	0..1	Specifies if several credit notations exist, alongside an 'any' or 'all' or all condition.	common_domain_model:creditNotations
CreditRatingDebt		CreditRatingDebt	Specifies the credit rating debt type(s) associated with the credit rating notation and scale. When several debt types are specified, they must be qualified through an 'any' or 'all'.							
					debtType	CreditRatingDebt_debtType	str	0..1	Specifies when there is only one debt type. FpML doesn't specify values in relation to the associated scheme, which is hence not specified as an enumeration as part of the CDM.	common_domain_model:debtType
					debtTypes		MultipleDebtTypes	0..1	Specifies if there are several debt types, alongside an 'any' or 'all' or all condition. As an example, Baa1 rating is required for any long term debt and deposit.	common_domain_model:debtTypes
CreditSupportAgreementElections		CreditSupportAgreementElections	The set of elections which specify a Credit Support Annex or Deed.							
CreditSupportAgreementElectionsBase		CreditSupportAgreementElectionsBase	A logical container designed to hold a set of related data. In this case, designed to hold a set of clauses that are common amongst Legacy (1994/95), Variation Margin and Initial Margin Credit Support Documents.							
					baseAndEligibleCurrency		BaseAndEligibleCurrency	1..1	The base and eligible currency(ies) for the document as specified by the parties to the agreement.	common_domain_model:baseAndEligibleCurrency
					conditionsPrecedent		ConditionsPrecedent	0..1	The set of elections that may overwrite the default Condition Precedent provision, and the set of provisions that are deemed Access Condition.	common_domain_model:conditionsPrecedent
					substitution		Substitution	0..1	The conditions under which the Security Provider can substitute posted collateral.	common_domain_model:substitution
					disputeResolution		DisputeResolution	1..1	The election terms under which a party disputes (i) the Calculation Agents calculation of a Delivery Amount or a Return Amount, or (ii) the Value of any Transfer of Eligible Credit Support or Posted Credit Support.	common_domain_model:disputeResolution
					holdingAndUsingPostedCollateral		HoldingAndUsingPostedCollateral	0..1	The elections for the holding and using of posted collateral by the respective parties to the Credit Support Annex for Variation Margin.	common_domain_model:holdingAndUsingPostedCollateral
					distributionAndInterestPayment		DistributionAndInterestPayment	0..1	The Distributions and Interest Payment terms specified as part of the agreement.	common_domain_model:distributionAndInterestPayment
					otherEligibleAndPostedSupport		OtherEligibleAndPostedSupport	0..1	The Other Eligible Support elections associated with margin agreements.	common_domain_model:otherEligibleAndPostedSupport
					demandsAndNotices		DemandsAndNotices	0..1	The optional specification of address where the demands, specifications and notices will be communicated to for each of the parties to the agreement.	common_domain_model:demandsAndNotices
					additionalRepresentations		AdditionalRepresentations	0..1	The specification Additional Representations that may be applicable to the agreement.	common_domain_model:additionalRepresentations
					masterAgreementDatedAsOfDate		MasterAgreementDatedAsOfDate	0..1	Defines the dates agreed by the parties as the date of the Credit Support Annex or Credit Support Deed.	common_domain_model:masterAgreementDatedAsOfDate
					finalReturns		FinalReturns	1..1	A clause providing that final return collateral is to be provided without consideration of any Minimum Transfer Amount and collateral haircut.	common_domain_model:finalReturns
CreditSupportAgreementInitialMarginElections	CreditSupportAgreementElectionsBase	CreditSupportAgreementInitialMarginElections	The set of elections which specify an Initial Margin Credit Support Annex or Deed.							
					regime		Regime	1..1	The Regime Table provision , which determines the regulatory regime(s) applicable to each of the parties to the agreement.	common_domain_model:regime
					oneWayProvisions		OneWayProvisions	1..1	The determination of whether the One Way Provisions are applicable (true) or not applicable (false).	common_domain_model:oneWayProvisions
					generalSimmElections		GeneralSimmElections	0..1	The specification of the ISDA SIMM Method for all Covered Transactions with respect to all Regimes.	common_domain_model:generalSimmElections
					identifiedCrossCurrencySwap		Bool	0..1	The qualification of whether cross-currency swaps need to be identified in the Confirmation so that the obligations to exchange principal be disregarded for the purpose of determining the Delivery Amount or Return Amount.	common_domain_model:identifiedCrossCurrencySwap
					sensitivityMethodologies		SensitivityMethodologies	1..1	The specification of methodologies to compute sensitivities specific to the agreement.	common_domain_model:sensitivityMethodologies
					fxHaircutCurrency		FxHaircutCurrency	0..1	The reference currency for the purpose of specifying the FX Haircut relating to a posting obligation, as being either the Termination Currency or an FX Designated Currency.	common_domain_model:fxHaircutCurrency
					postingObligations		PostingObligations	1..1	The security providers posting obligations.	common_domain_model:postingObligations
					substitutedRegime		SubstitutedRegime	0..*	The specification of Additional regimes for purposes of determining whether a Regulatory Event has occurred.	common_domain_model:substitutedRegime
					coveredTransactions		CoveredTransactions	0..1	The specification of transactions covered by the terms of the agreement.	common_domain_model:coveredTransactions
					rightsEvents		RightsEvents	1..1	The bespoke provisions that might be specified by the parties to the agreement to specify the rights of Security Taker and/or Security Provider when an Early Termination or Access Condition event has occurred.	common_domain_model:rightsEvents
					custodyArrangements		CustodyArrangements	0..1	The Custodian and Segregated Account details in respect of each party to the agreement.	common_domain_model:custodyArrangements
					otherAgreements		OtherAgreements	0..1	The bespoke definition of other agreement terms as specified by the parties to the agreement.	common_domain_model:otherAgreements
					terminationCurrencyAmendment		TerminationCurrencyAmendment	1..1	The bespoke provision that might be specified by the parties to the agreement applicable to Termination Currency.  Unless specified the definition of Termination Currency has the meaning specified in the Schedule to the ISDA Master Agreement.	common_domain_model:terminationCurrencyAmendment
					minimumTransferAmountAmendment		MinimumTransferAmountAmendment	1..1	The bespoke provision that might be specified by the parties to the agreement applicable to Minimum Transfer Amount.  Unless specified the definition of Minimum Transfer Amount in any Other Regulatory CSA has the meaning specified in such Other Regulatory CSA.	common_domain_model:minimumTransferAmountAmendment
					interpretationTerms		str	0..1	The bespoke provision that might be specified by the parties to the agreement applicable to Interpretations.	common_domain_model:interpretationTerms
					processAgent		ProcessAgent	1..1	The Process Agent that might be appointed by the parties to the agreement.	common_domain_model:processAgent
					appropriatedCollateralValuation		AppropriatedCollateralValuation	0..1	The election for the Valuation of Appropriate Collateral.	common_domain_model:appropriatedCollateralValuation
					jurisdictionRelatedTerms		JurisdictionRelatedTerms	0..1	The jurisdiction specific terms relevant to the agreement.	common_domain_model:jurisdictionRelatedTerms
					additionalAmendments		str	0..1	Any additional amendments that might be specified by the parties to the agreement.	common_domain_model:additionalAmendments
					additionalBespokeTerms		str	0..1	Any additional terms that might be specified applicable.	common_domain_model:additionalBespokeTerms
					trustSchemeAddendum		Bool	1..1	The qualification of whether Trust Scheme Addendum is applicable (True) or not applicable (False).	common_domain_model:trustSchemeAddendum
					clientAssetSourcebookAdditionalLanguage		str	0..1	Details of language relating to Client Asset and Money Rules (CASS).	common_domain_model:clientAssetSourcebookAdditionalLanguage
					creditSupportObligations		CreditSupportObligationsInitialMargin	1..1	The Credit Support Obligations applicable to the agreement.	common_domain_model:creditSupportObligations
					calculationAndTiming		CalculationAndTimingInitialMargin	1..1	The set of elections for determining Valuation and Timing terms specific to the agreement.	common_domain_model:calculationAndTiming
CreditSupportAgreementLegacyElections	CreditSupportAgreementElectionsBase	CreditSupportAgreementLegacyElections	The set of elections which specify a Legacy (1994 or 1995) Credit Support Annex or Deed.							
					exchangeDate		str	0..1	The bespoke exchange date terms that might be specified by the parties to the agreement.	common_domain_model:exchangeDate
					addressesForTransfer		AddressesForTransfer	0..1	The optional specification of address for transfer as specified by the respective parties to the agreement.	common_domain_model:addressesForTransfer
					securityInterestForObligations	CreditSupportAgreementLegacyElections_securityInterestForObligations	SecurityInterestForObligations	1..1	The party to whom obligations under the Master Agreement are owed and secured by the credit support arrangements. Applicable to 1994 NY CSA, 1995 English Law CSD and 2016 New York Law VM CSA.	common_domain_model:securityInterestForObligations
					singlePostingParty		SinglePostingParty	0..1	Where only a single  party is explicitly designated to post collateral, the party which is specified as the sole poster of collateral.	common_domain_model:singlePostingParty
					creditSupportObligations	CreditSupportAgreementLegacyElections_creditSupportObligations	CreditSupportObligationsLegacy	1..1	The Credit Support Obligations applicable to the agreement.	common_domain_model:creditSupportObligations
					calculationAndTiming	CreditSupportAgreementLegacyElections_calculationAndTiming	CalculationAndTimingLegacy	1..1	The set of elections for determining Valuation and Timing terms specific to the agreement.	common_domain_model:calculationAndTiming
CreditSupportAgreementVariationMarginElections	CreditSupportAgreementElectionsBase	CreditSupportAgreementVariationMarginElections	The set of elections which specify a Variation Margin Credit Support Annex or Deed.							
					fxHaircutCurrency		FxHaircutCurrency	0..1	The reference currency for the purpose of specifying the FX Haircut relating to a posting obligation, as being either the Termination Currency or an FX Designated Currency.	common_domain_model:fxHaircutCurrency
					exchangeDate		str	0..1	The bespoke exchange date terms that might be specified by the parties to the agreement.	common_domain_model:exchangeDate
					coveredTransactions	CreditSupportAgreementVariationMarginElections_coveredTransactions	CoveredTransactions	1..1	The specification of transactions covered by the terms of the agreement.	common_domain_model:coveredTransactions
					creditSupportOffsets		Bool	1..1	The specification of whether the standard Credit Support Offset provisions are applicable (true) or not applicable (false).	common_domain_model:creditSupportOffsets
					custodyArrangements		CustodyArrangements	0..1	The Custodian and Segregated Account details in respect of each party to the agreement.	common_domain_model:custodyArrangements
					addressesForTransfer		AddressesForTransfer	0..1	The optional specification of address for transfer as specified by the respective parties to the agreement.	common_domain_model:addressesForTransfer
					otherAgreements		OtherAgreements	0..1	The bespoke definition of other agreement terms as specified by the parties to the agreement.	common_domain_model:otherAgreements
					securityInterestForObligations		SecurityInterestForObligations	1..1	The party to whom obligations under the Master Agreement are owed and secured by the credit support arrangements. Applicable to 1994 NY CSA, 1995 English Law CSD and 2016 New York Law VM CSA.	common_domain_model:securityInterestForObligations
					creditSupportObligations	CreditSupportAgreementVariationMarginElections_creditSupportObligations	CreditSupportObligationsVariationMargin	1..1	The Credit Support Obligations applicable to the agreement.	common_domain_model:creditSupportObligations
					calculationAndTiming	CreditSupportAgreementVariationMarginElections_calculationAndTiming	CalculationAndTimingVariationMargin	1..1	The set of elections for determining Valuation and Timing terms specific to the agreement.	common_domain_model:calculationAndTiming
CreditSupportAmount		CreditSupportAmount	The total amount one counterparty must deliver to the other at any time: the combination of the Exposure to that party and the net Independent Amounts it must post, minus any agreed Threshold.							
					creditSupportAmount	CreditSupportAmount_creditSupportAmount	CreditSupportAmountEnum	1..1	Specifies whether the meaning of credit support amount follows the pre-print definition or deviates from the standard (either based on a rating or some other methodology).	common_domain_model:creditSupportAmount
					additionalLanguage	CreditSupportAmount_additionalLanguage	str	0..1	The additional language that might be specified by the parties to the legal agreement.	common_domain_model:additionalLanguage
CreditSupportDocument		CreditSupportDocument	Identification of party specific Credit Support Documents applicable to the document.							
					creditSupportDocumentElection		CreditSupportDocumentElection	1..*	The party election of Credit Support Document(s), if any.	common_domain_model:creditSupportDocumentElection
CreditSupportDocumentElection		CreditSupportDocumentElection	The party election of Credit Support Provider(s), if any.							
					party	CreditSupportDocumentElection_party	Party	1..1	The elective party.	common_domain_model:party
					creditSupportDocumentTerms		CreditSupportDocumentTermsEnum	1..1	Specification of the Credit Support Document terms.	common_domain_model:creditSupportDocumentTerms
					creditSupportDocumentTypes		LegalAgreementIdentification	0..*	If a Credit Support Document is specified but not yet in CDM representation, it can still be captured. This argument should be used if the creditSupportDocument argument cannot be used due to not being able to represent the document fully in CDM format.	common_domain_model:creditSupportDocumentTypes
					creditSupportDocument		LegalAgreement	0..*	The specified Credit Support Document(s), if any.	common_domain_model:creditSupportDocument
					bespokeCreditSuppportDocument		str	0..1	Specification of a document when not captured under RelatedAgreement.	common_domain_model:bespokeCreditSuppportDocument
CreditSupportObligationsBase		CreditSupportObligationsBase	A logical container designed to hold a set of related data. In this case, designed to hold a set of clauses that are common amongst Legacy (1994/95), Variation Margin and Initial Margin Credit Support Documents in regards to Credit Support Obligations.							
					deliveryAmount	CreditSupportObligationsBase_deliveryAmount	CSADeliveryAmount	1..1	In respect of a Valuation Date, the amount of collateral which a party is entitled to demand to be transferred to it as a Delivery Amount.	common_domain_model:deliveryAmount
					returnAmount	CreditSupportObligationsBase_returnAmount	CSAReturnAmount	1..1	In respect of a Valuation Date, the amount of collateral which a party is entitled to demand to be recalled to it as a Return Amount.	common_domain_model:returnAmount
					minimumTransferAmount		MinimumTransferAmount	1..1	Represents the threshold specified in the agreement below which collateral need not be delivered, and represents the smallest incremental value of exposure that must be reached before the parties are obliged to transfer collateral.	common_domain_model:minimumTransferAmount
					collateralTransferTiming		CollateralTransferTiming	0..1	Specification of transfer / settlement timing for cash and securities collateral assuming that the notice is provided before the Notification Time (and with a 1LBD lag introduced if the notice is delivered after the Notification Time), and that securities allow for a further Local Business Day for transfer / settlement.	common_domain_model:collateralTransferTiming
					bespokeTransferTiming		BespokeTransferTiming	0..1	The time by which the transfer of collateral must take place when different from the Regular Settlement Day as a result of parties' election.	common_domain_model:bespokeTransferTiming
CreditSupportObligationsCollateralTransferAgreement	CreditSupportObligationsBase	CreditSupportObligationsCollateralTransferAgreement	Specification of the Credit Support Obligations applicable to the Initial Margin Credit Support Annex.							
					marginApproach	CreditSupportObligationsCollateralTransferAgreement_marginApproach	MarginApproach	1..1	The selection of Margin Approach applicable to the agreement.	common_domain_model:marginApproach
					otherEligibleSupportIM		str	0..1	The Other Eligible Support election. If not specified, this election is deemed as not applicable.	common_domain_model:otherEligibleSupportIM
					threshold		Threshold	1..1	Represents the amount of unsecured risk that a party is willing to tolerate without holding any posted collateral provided by the other party.	common_domain_model:threshold
					creditSupportAmount		CreditSupportAmount	1..1	The total amount one counterparty must deliver to the other at any time: the combination of the Exposure to that party and the net Independent Amounts it must post, minus any agreed Threshold.	common_domain_model:creditSupportAmount
					rounding	CreditSupportObligationsCollateralTransferAgreement_rounding	CollateralRounding	0..1	The rounding methodology applicable to the Delivery Amount and the Return Amount in terms of nearest integral multiple of Base Currency units.	common_domain_model:rounding
CreditSupportObligationsInitialMargin	CreditSupportObligationsBase	CreditSupportObligationsInitialMargin	Specification of the Credit Support Obligations applicable to the Initial Margin Credit Support Annex.							
					marginApproach	CreditSupportObligationsInitialMargin_marginApproach	MarginApproach	1..1	The selection of Margin Approach applicable to the agreement.	common_domain_model:marginApproach
					otherEligibleSupportIM		str	0..1	The Other Eligible Support election. If not specified, this election is deemed as not applicable.	common_domain_model:otherEligibleSupportIM
