Class Name	Parent Class	YAML Class Name	Description	Flags	Slot Name	YAML Slot Name	Range	Card	Slot Description	URI
Account		Account	A class to specify an account as an account number alongside, optionally. an account name, an account type, an account beneficiary and a servicing party.							
					partyReference	Account_partyReference	Party	1..1	A reference to the party to which the account refers to.	common_domain_model:partyReference
					accountNumber		str	1..1	The account number.	common_domain_model:accountNumber
					accountName		str	0..1	The name by which the account is known.	common_domain_model:accountName
					accountType		AccountTypeEnum	0..1	The type of account, e.g. client, house.	common_domain_model:accountType
					accountBeneficiary		Party	0..1	A reference to the party beneficiary of the account.	common_domain_model:accountBeneficiary
					servicingParty		Party	0..1	The reference to the legal entity that services the account, i.e. in the books of which the account is held.	common_domain_model:servicingParty
AccrualFactor		AccrualFactor	The accrual rate and related terms, to adjust the price of an underlier impacted by a Corporate Action when economic impact consists in freezing the underlier price to the last fixing then applying accruals per each remaining underlier price fixing date required i.e. for each fixing date, adjustedPrice = lastFixingPrice x accrualFactor, where: accrualFactor = (1 + accrualRateValue x DCF).							
					value	AccrualFactor_value	PriceSchedule	1..1	The rate to be applied to the last fixing price, for price accrual calculation purposes. DatedValue may be used for the purpose of representing Price series if such calculation is required for multiple dates.	common_domain_model:value
					calculationTerms	AccrualFactor_calculationTerms	AccrualFactorCalculationTerms	0..1	Describes the input terms involved in the calculation of the accrual factor.	common_domain_model:calculationTerms
AccrualFactorCalculationTerms		AccrualFactorCalculationTerms	Describes the input terms involved in the calculation of the accrual factor. Optionnally, long and short stub interpolation rates can be specified.							
					tenorTillMaturity		Decimal	1..1	The duration between last fixing date and the payment date of accruals, calculated in accordance with the appropriate DayCountFraction.	common_domain_model:tenorTillMaturity
					dayCountFraction		DayCountFractionEnum	1..1	The enumerated values to specify the day count fraction.	common_domain_model:dayCountFraction
					interpolationTerms		StubValue	0..1	Describes the rate, tenor, period duration for the short and long stubs, when the accrualRate optionnaly results from an interpolation method.	common_domain_model:interpolationTerms
AcctOwnr		AcctOwnr								
					id		Id	1..1		common_domain_model:id
AdditionalDisruptionEvents		AdditionalDisruptionEvents	A type for defining the Additional Disruption Events.							
					changeInLaw		Bool	0..1		common_domain_model:changeInLaw
					failureToDeliver		Bool	0..1	If true, failure to deliver is applicable.	common_domain_model:failureToDeliver
					insolvencyFiling		Bool	0..1		common_domain_model:insolvencyFiling
					hedgingDisruption		Bool	0..1		common_domain_model:hedgingDisruption
					increasedCostOfHedging		Bool	0..1		common_domain_model:increasedCostOfHedging
					foreignOwnershipEvent		Bool	0..1		common_domain_model:foreignOwnershipEvent
					lossOfStockBorrow		Bool	0..1		common_domain_model:lossOfStockBorrow
					maximumStockLoanRate		Decimal	0..1	Specifies the maximum stock loan rate for Loss of Stock Borrow. A percentage of 5% is represented as 0.05.	common_domain_model:maximumStockLoanRate
					increasedCostOfStockBorrow		Bool	0..1		common_domain_model:increasedCostOfStockBorrow
					initialStockLoanRate		Decimal	0..1	Specifies the initial stock loan per ISDA Def. A percentage of 5% is represented as 0.05.	common_domain_model:initialStockLoanRate
					determiningParty		AncillaryRoleEnum	0..1	Specifies the party which determines additional disruption events.	common_domain_model:determiningParty
					additionalBespokeTerms	AdditionalDisruptionEvents_additionalBespokeTerms	Clause	0..*	Where parties may optionnaly describe any extra bespoke agreements, in regards of the standardized Extraordinary Events.	common_domain_model:additionalBespokeTerms
AdditionalFixedPayments		AdditionalFixedPayments	A class to specify the events that will give rise to the payment additional fixed payments.							
					interestShortfallReimbursement		Bool	0..1	An additional Fixed Payment Event. Corresponds to the payment by or on behalf of the Issuer of an actual interest amount in respect to the reference obligation that is greater than the expected interest amount. ISDA 2003 Term: Interest Shortfall Reimbursement.	common_domain_model:interestShortfallReimbursement
					principalShortfallReimbursement		Bool	0..1	An additional Fixed Payment Event. Corresponds to the payment by or on behalf of the Issuer of an actual principal amount in respect to the reference obligation that is greater than the expected principal amount. ISDA 2003 Term: Principal Shortfall Reimbursement.	common_domain_model:principalShortfallReimbursement
					writedownReimbursement		Bool	0..1	An Additional Fixed Payment. Corresponds to the payment by or on behalf of the issuer of an amount in respect to the reference obligation in reduction of the prior writedowns. ISDA 2003 Term: Writedown Reimbursement.	common_domain_model:writedownReimbursement
AdditionalObligations		AdditionalObligations	The election of party specific additional obligations applicable to the agreement.							
					party	AdditionalObligations_party	CounterpartyRoleEnum	1..1	The party that the additional obligations apply to.	common_domain_model:party
					additionalObligations		str	1..1	The party specific additional obligations applicable to the agreement.	common_domain_model:additionalObligations
AdditionalRepresentation		AdditionalRepresentation	A class to specify the Additional Representation.							
					partyElection		AdditionalRepresentationElection	1..*	A qualification as to whether the Additional Representation is applicable.	common_domain_model:partyElection
					customElection		str	0..1	A supplemental custom election that might be specified by the parties for the purpose of specifying the Additional Representation.	common_domain_model:customElection
AdditionalRepresentationElection		AdditionalRepresentationElection	A class to specify the parties' Additional Representation(s) election.							
					party	AdditionalRepresentationElection_party	CounterpartyRoleEnum	1..1	The elective party.	common_domain_model:party
					isApplicable		Bool	1..1	The Additional Representation is applicable when True, and not applicable when False.	common_domain_model:isApplicable
					additionalLanguage	AdditionalRepresentationElection_additionalLanguage	str	0..1	Details of any Additional Representations given by the relevant parties in relation to the collateral arrangement.	common_domain_model:additionalLanguage
AdditionalRepresentations		AdditionalRepresentations	A class to specify Additional Representations that may be applicable to an agreement.							
					additionalRepresentation		AdditionalRepresentation	0..1	The specification of the Additional Representation that may be applicable to the agreement.	common_domain_model:additionalRepresentation
					regulatoryComplianceRepresentation		Bool	0..1	The qualification of whether Additional Information related to Regulatory Compliance and Concentration Limits is applicable or not.	common_domain_model:regulatoryComplianceRepresentation
AdditionalRightsEvent		AdditionalRightsEvent	A class to specify the Pledgor/Obligor/Chargor Additional Rights Event election.							
					isApplicable	AdditionalRightsEvent_isApplicable	Bool	1..1	The Pledgor Additional Rights Event election is applicable when True, and not applicable when False.	common_domain_model:isApplicable
					qualification	AdditionalRightsEvent_qualification	str	1..1	The qualification of the Pledgor Additional Rights Event election, when specified.	common_domain_model:qualification
AdditionalTerminationEvent		AdditionalTerminationEvent	A class to specify an optional termination event, additional to the Termination Events that will be deemed an Access Condition (Initial Margin CSA) or a Specified Condition (Variation Margin CSA).							
					name	AdditionalTerminationEvent_name	str	1..1	The name of the additional termination event.	common_domain_model:name
					applicableParty		CounterpartyRoleEnum	1..*	Whether the additional termination event is applicable for the relevant party.	common_domain_model:applicableParty
AdditionalType		AdditionalType	The specification of the Additional Type of transaction that can require the collection or delivery of initial margin under a given regulatory regime for the purposes of Covered Transactions.							
					standardValue		AdditionalTypeEnum	1..1	The qualification of the Additional Type of transaction that can require the collection or delivery of initial margin when specified as a standard value.	common_domain_model:standardValue
					customValue		str	0..1	The qualification of the Additional Type of transaction that can require the collection or delivery of initial margin when specified as a custom value by the parties to the legal agreement.	common_domain_model:customValue
Address		Address	A class to specify a post or street address.							
					street		str	1..*	The set of street and building number information that identifies a postal address within a city.	common_domain_model:street
					city		str	0..1	The city component of the postal address.	common_domain_model:city
					state		str	0..1	A country subdivision used in postal addresses in some countries. For example, US states, Canadian provinces, Swiss cantons, ...	common_domain_model:state
					country		str	0..1	The ISO 3166 standard code for the country within which the postal address is located.	common_domain_model:country
					postalCode		str	0..1	The code, required for computerized mail sorting systems, that is allocated to a physical address by a national postal authority.	common_domain_model:postalCode
AddressesForTransfer		AddressesForTransfer	Specifies the address for transfer as specified by the respective parties to the agreement.							
					partyElection	AddressesForTransfer_partyElection	TransferInformationElection	1..*	The parties' contact and transfer information election.	common_domain_model:partyElection
AddtlAttrbts		AddtlAttrbts								
					rskRdcgTx		str	1..1		common_domain_model:rskRdcgTx
					sctiesFincgTxInd		str	1..1		common_domain_model:sctiesFincgTxInd
AdjustableDate		AdjustableDate	A class for defining a date that shall be subject to adjustment if it would otherwise fall on a day that is not a business day in the specified business centers, together with the convention for adjusting the date.							
					unadjustedDate		XSDDate	0..1	A date subject to adjustment. While in FpML this date is required, this cardinality constraint has been relaxed as part of the CDM in order to support the FRA representation, which effective and termination dates are specified in FpML as adjusted dates.	common_domain_model:unadjustedDate
					dateAdjustments		BusinessDayAdjustments	0..1	The business day convention and financial business centers used for adjusting the date if it would otherwise fall on a day that is not a business date in the specified business centers.	common_domain_model:dateAdjustments
					dateAdjustmentsReference		BusinessDayAdjustments	0..1	A pointer style reference to date adjustments defined elsewhere in the document.	common_domain_model:dateAdjustmentsReference
					adjustedDate		XSDDate	0..1	The date once the adjustment has been performed. (Note that this date may change if the business center holidays change).	common_domain_model:adjustedDate
AdjustableDates		AdjustableDates	A class for defining a series of dates that shall be subject to adjustment if they would otherwise fall on a day that is not a business day in the specified business centers, together with the convention for adjusting the dates.							
					unadjustedDate	AdjustableDates_unadjustedDate	XSDDate	0..*	A date subject to adjustment.	common_domain_model:unadjustedDate
					dateAdjustments		BusinessDayAdjustments	0..1	The business day convention and financial business centers used for adjusting the date if it would otherwise fall on a day that is not a business date in the specified business centers.	common_domain_model:dateAdjustments
					adjustedDate	AdjustableDates_adjustedDate	XSDDate	0..*	The date(s) once the adjustment has been performed. (Note that this date may change if the business center holidays change).	common_domain_model:adjustedDate
AdjustableOrAdjustedDate		AdjustableOrAdjustedDate	A class for defining a date that shall be subject to adjustment if it would otherwise fall on a day that is not a business day in the specified business centers, together with the convention for adjusting the date.							
					unadjustedDate	AdjustableOrAdjustedDate_unadjustedDate	XSDDate	0..1	A date subject to adjustment.	common_domain_model:unadjustedDate
					dateAdjustments		BusinessDayAdjustments	0..1	The business day convention and financial business centers used for adjusting the date if it would otherwise fall on a day that is not a business date in the specified business centers.	common_domain_model:dateAdjustments
					adjustedDate		XSDDate	0..1	The date once the adjustment has been performed. (Note that this date may change if the business center holidays change).	common_domain_model:adjustedDate
AdjustableOrAdjustedOrRelativeDate		AdjustableOrAdjustedOrRelativeDate	This Rosetta class specifies the date as either an unadjusted, adjusted or relative date. It supplements the features of the AdjustableOrAdjustedDate to support the credit default swap option premium, which uses the relative date construct.							
					unadjustedDate	AdjustableOrAdjustedOrRelativeDate_unadjustedDate	XSDDate	0..1	A date subject to adjustment.	common_domain_model:unadjustedDate
					dateAdjustments		BusinessDayAdjustments	0..1	The business day convention and financial business centers used for adjusting the date if it would otherwise fall on a day that is not a business date in the specified business centers.	common_domain_model:dateAdjustments
					adjustedDate		XSDDate	0..1	The date once the adjustment has been performed. (Note that this date may change if the business center holidays change).	common_domain_model:adjustedDate
					relativeDate		RelativeDateOffset	0..1	A date specified as some offset to another date (the anchor date).	common_domain_model:relativeDate
AdjustableOrRelativeDate		AdjustableOrRelativeDate	A class giving the choice between defining a date as an explicit date together with applicable adjustments or as relative to some other (anchor) date.							
					adjustableDate		AdjustableDate	0..1	A date that shall be subject to adjustment if it would otherwise fall on a day that is not a business day in the specified business centers, together with the convention for adjusting the date.	common_domain_model:adjustableDate
					relativeDate	AdjustableOrRelativeDate_relativeDate	AdjustedRelativeDateOffset	0..1	A date specified as some offset to another date (the anchor date).	common_domain_model:relativeDate
AdjustableOrRelativeDates		AdjustableOrRelativeDates	A class giving the choice between defining a series of dates as an explicit list of dates together with applicable adjustments or as relative to some other series of (anchor) dates.							
					adjustableDates		AdjustableDates	0..1	A series of dates that shall be subject to adjustment if they would otherwise fall on a day that is not a business day in the specified business centers, together with the convention for adjusting the date.	common_domain_model:adjustableDates
					relativeDates		RelativeDates	0..1	A series of dates specified as some offset to another series of dates (the anchor dates).	common_domain_model:relativeDates
AdjustableRelativeOrPeriodicDates		AdjustableRelativeOrPeriodicDates	A class giving the choice between defining a series of dates as an explicit list of dates together with applicable adjustments or as relative to some other series of (anchor) dates, or as a calculation period schedule.							
					adjustableDates		AdjustableDates	0..1	A series of dates that shall be subject to adjustment if they would otherwise fall on a day that is not a business day in the specified business centers, together with the convention for adjusting the date.	common_domain_model:adjustableDates
					relativeDates		RelativeDates	0..1	A series of dates specified as some offset to another series of dates (the anchor dates).	common_domain_model:relativeDates
					periodicDates		PeriodicDates	0..1	A calculation period schedule.	common_domain_model:periodicDates
AdjustedRelativeDateOffset	RelativeDateOffset	AdjustedRelativeDateOffset	A type defining a date (referred to as the derived date) as a relative offset from another date (referred to as the anchor date) plus optional date adjustments.							
					relativeDateAdjustments		BusinessDayAdjustments	0..1	The business day convention and financial business centers used for adjusting the relative date if it would otherwise fall on a day that is not a business date in the specified business centers.	common_domain_model:relativeDateAdjustments
AdjustmentFactor		AdjustmentFactor	Describes the terms involved for adjusting the price of the underlier impacted by a Corporate Action.							
					value	AdjustmentFactor_value	Decimal	1..1	The multiplier value applied to the price of the underlier impacted by a Corporate Action.	common_domain_model:value
					calculationTerms		AdjustmentFactorCalculationTerms	0..1	Describes the input terms involved in the calculation of the adjustment factor applied to the price of the underlier impacted by a Corporate Action.	common_domain_model:calculationTerms
AdjustmentFactorCalculationTerms		AdjustmentFactorCalculationTerms	Describes the input terms involved in the calculation of the adjustment factor applied to the price of the underlier impacted by a Corporate Action.							
					shareForShareRatio		Decimal	0..1	Multiple value, say 'M/N' where 'M' is the number of shares after the event and 'N' is the number of shares prior to the event. 	common_domain_model:shareForShareRatio
					shareForRightsRatio		Decimal	0..1	Multiple value, say 'M/N' where 'M' is the number of rights after the event, and 'N' of shares prior to the event. 	common_domain_model:shareForRightsRatio
					rightsSubscriptionPrice		Price	0..1	The price to pay per each right.	common_domain_model:rightsSubscriptionPrice
					dividendRatio		Decimal	0..1	Multiplier value (e.g. 85 %, etc.) to calculate net dividend amount, given gross amount before taking into account the relevant fiscal features.	common_domain_model:dividendRatio
					spinOff		SpinOff	0..1	Defines the underlier for both the Parent Company and the Child Compagny involved in Spin Off corporate action, as well as the respective price observation for each.	common_domain_model:spinOff
					merger		Merger	0..1	Defines the underlier for both the Purchaser Company and the Acquired Compagny involved in Spin Off corporate action, as well as the respective price observation for each.	common_domain_model:merger
					accrualFactor		AccrualFactor	0..1	The accrual rate and related terms, to adjust the price of an underlier impacted by a Corporate Action when economic impact consists in freezing the underlier price to last fixing and applying accruals for each remaining underlier price fixing date required i.e. for each, adjustedPrice = lastFixingPrice x (1 + accrualRate x DCF).	common_domain_model:accrualFactor
					lastFixingPriceBeforeAdjustment		Price	0..1	The last fixing price of the Underlier affected by the CorporateAction, before any adjustment with regards to the CorporateAction.	common_domain_model:lastFixingPriceBeforeAdjustment
					dividendObservation		PriceSchedule	0..1	To record observations of dividends.	common_domain_model:dividendObservation
					bespokeCalculationFormula		str	0..1	To describe the formula used to calculate the Adjustment Factor.	common_domain_model:bespokeCalculationFormula
AgencyRatingCriteria		AgencyRatingCriteria	Represents a class to specify a credit notation.							
					creditNotation	AgencyRatingCriteria_creditNotation	CreditNotation	1..1	Indicates the agency rating criteria specified for the asset or issuer.	common_domain_model:creditNotation
					mismatchResolution	AgencyRatingCriteria_mismatchResolution	CreditNotationMismatchResolutionEnum	0..1	Indicator for options to be used if several agency ratings (>1) are specified and its necessary to identify specific charateristics. i.e (lowest or highest).	common_domain_model:mismatchResolution
					referenceAgency	AgencyRatingCriteria_referenceAgency	CreditRatingAgencyEnum	0..1	identifies the dominant reference agency if there is a missmatch and several reference agencies exsist.	common_domain_model:referenceAgency
					boundary		CreditNotationBoundaryEnum	0..1	Indicates the boundary of a credit agency rating i.e minimum or maximum.	common_domain_model:boundary
Aggregation		Aggregation	The definitions for whether aggregation applies to the GMSLA, and if so how it applies.							
					aggregationType		AggregationSpecificationEnum	1..1	How is the mark to market value determined?	common_domain_model:aggregationType
					loansCanBeGrouped		Bool	1..1	The mark to market can be defined separately for different groups of loans.	common_domain_model:loansCanBeGrouped
					otherDetails		str	0..1	Any specfic elections that are not captured by the above options, such as grouping information.	common_domain_model:otherDetails
AggregationParameters		AggregationParameters	 Parameters to be used to filter events that are relevant to a given portfolio in order to calculate the state of this portfolio. The attributes correspond to all the possible aggregation criteria that can be used and these criteria can be combined. All the attributes are optional.							
					dateTime	AggregationParameters_dateTime	XSDDateTime	1..*	To aggregate as of a particular date	common_domain_model:dateTime
					totalPosition		Bool	0..1	Specifies whether to calculate total position to given date, or only daily position for the given date.	common_domain_model:totalPosition
					positionStatus		PositionStatusEnum	0..1	To aggregate based on position status (EXECUTED, SETTLED etc)	common_domain_model:positionStatus
					party	AggregationParameters_party	Party	0..*	To aggregate based on a selection of party(ies) / legal entity(ies).	common_domain_model:party
					product	AggregationParameters_product	NonTransferableProduct	1..*	To aggregate based on a selection of products.	common_domain_model:product
					productQualifier	AggregationParameters_productQualifier	str	0..*	To aggregate based on a selection of product type(s).	common_domain_model:productQualifier
					tradeReference		Trade	0..*		common_domain_model:tradeReference
Agreement		Agreement	Specification of the standard set of terms that define a legal agreement.							
					creditSupportAgreementElections		CreditSupportAgreementElections	0..1	Elections to specify a Credit Support Annex or Credit Support Deed for Intial or Variation Margin.	common_domain_model:creditSupportAgreementElections
					collateralTransferAgreementElections		CollateralTransferAgreementElections	0..1	Elections to specify a Collateral Transfer Agreement.	common_domain_model:collateralTransferAgreementElections
					securityAgreementElections		SecurityAgreementElections	0..1	Elections to specify a Security agreement.	common_domain_model:securityAgreementElections
					masterAgreementSchedule		MasterAgreementSchedule	0..1	Elections to specify a Master Agreement Schedule.	common_domain_model:masterAgreementSchedule
					transactionAdditionalTerms		TransactionAdditionalTerms	0..1	Any additional terms which mainly intend to specify the extraordinary events that may affect a trade and the related contractual rights and obligation of the parties when this happens	common_domain_model:transactionAdditionalTerms
					masterAgreementElections		MasterAgreementElections	0..1	A legal representation of the different possible master agreements	common_domain_model:masterAgreementElections
AgreementName		AgreementName	Specifies the agreement name through an agreement type and optional detailed sub agreement type.							
					agreementType		LegalAgreementTypeEnum	1..1	Specification of the legal agreement type.	common_domain_model:agreementType
					creditSupportAgreementType		CreditSupportAgreementTypeEnum	0..1	Specification of the credit support agreement type.	common_domain_model:creditSupportAgreementType
					creditSupportAgreementMarginType		CollateralMarginTypeEnum	0..1	specifies the type of margin for which a legal agreement is named.	common_domain_model:creditSupportAgreementMarginType
					contractualDefinitionsType		ContractualDefinitionsEnum	0..*	The definitions such as those published by ISDA that will define the terms of the trade.	common_domain_model:contractualDefinitionsType
					contractualTermsSupplement		ContractualTermsSupplement	0..*	A contractual supplement (such as those published by ISDA) that will apply to the trade.	common_domain_model:contractualTermsSupplement
