Class Name	Parent Class	YAML Class Name	Description	Flags	Slot Name	YAML Slot Name	Range	Card	Slot Description	URI
					performance		str	0..1	Performance calculation, in accordance with Part 1 Section 12 of the 2018 ISDA CDM Equity Confirmation for Security Equity Swap, Para 75. 'Equity Performance'. Cumulative performance is used as a notional multiplier factor on both legs of an Equity Swap.	common_domain_model:performance
PriceSchedule	MeasureSchedule	PriceSchedule	Specifies the price of a financial instrument in a trade as a schedule of measures. A price generically expresses the value of an exchange as a ratio: it measures the amount of one thing needed to be exchanged for 1 unit of another thing (e.g. cash in a specific currency in exchange for a bond or share). This generic representation can be used to support any type of financial price beyond just cash price: e.g. an interest rate, a foreign exchange rate, etc. This data type is generically based on a schedule and can also be used to represent a price as a single value.							
					perUnitOf		UnitType	0..1	Provides an attribute to define the unit of the thing being priced. For example, {amount, unitOfAmount, PerUnitOfAmount} = [10, EUR, Shares] = (10.00 EUR/SHARE) * (300,000 SHARES) = EUR 3,000,000.00 (Shares cancel out in the calculation).	common_domain_model:perUnitOf
					priceType		PriceTypeEnum	1..1	Specifies the price type as an enumeration: interest rate, exchange rate, asset price etc. This attribute is mandatory so that prices can always be clasiffied according to their type. The price type implies some constraints on the price's units.	common_domain_model:priceType
					priceSubType		PriceSubTypeEnum	0..1	Allows further classification of the chosen price type.	common_domain_model:priceSubType
					priceExpression		PriceExpressionEnum	0..1	(Optionally) Specifies whether the price is expressed in absolute or percentage terms.	common_domain_model:priceExpression
					composite		PriceComposite	0..1	(Optionally) Specifies the underlying price components if the price can be expressed as a composite: e.g. dirty price = clean price + accrued.	common_domain_model:composite
					arithmeticOperator	PriceSchedule_arithmeticOperator	ArithmeticOperationEnum	1..1	(Optionally) When the price is to be understood as an operator to apply to an observable, i.e. a spread, multiplier or min/max.	common_domain_model:arithmeticOperator
					premiumType		PremiumTypeEnum	0..1	(Optionally) Additional attribute that can further define any premium to the price.	common_domain_model:premiumType
PriceSource		PriceSource	Specifies a publication that provides the commodity price, including, where applicable, the details of where in the publication the price is published.							
					pricePublisher		str	1..1	Defines a publication in which the price can be found. (e.g Gas Daily, Platts Bloomberg. Commodity publishers can be found at this URL:  http://www.fpml.org/coding-scheme/commodity-information-provider>	common_domain_model:pricePublisher
					priceSourceLocation		str	0..1	Specifies the location of the price which may be a specific page, electornic screen name, or a code (e.g. a RIC code) where the price can be found.	common_domain_model:priceSourceLocation
					priceSourceHeading		str	0..1	Specifies the heading or field name for the price  on a given page or screen, where applicable.	common_domain_model:priceSourceHeading
					priceSourceTime		XSDTime	0..1	Specifies the time at which the price should be observed.	common_domain_model:priceSourceTime
PriceSourceDisruption		PriceSourceDisruption	A data defining:  the parameters used to get a price quote to replace the settlement rate option that is disrupted.							
					fallbackReferencePrice	PriceSourceDisruption_fallbackReferencePrice	FallbackReferencePrice	1..1	The method, prioritised by the order it is listed in this element, to get a replacement rate for the disrupted settlement rate option.	common_domain_model:fallbackReferencePrice
PricingDates		PricingDates	Specifies specific dates or parametric rules for the dates on which the price will be determined							
					specifiedDates		AdjustableDates	0..*	Defines specified dates on which the price will be determined.	common_domain_model:specifiedDates
					parametricDates	PricingDates_parametricDates	ParametricDates	0..1	Defines rules for the dates on which the price will be determined.	common_domain_model:parametricDates
PrimitiveInstruction		PrimitiveInstruction	A Primitive Instruction describes the inputs required to pass into the corresponding PrimitiveEvent function.							
					contractFormation		ContractFormationInstruction	0..1	Specifies instructions describing an contract formation primitive event.	common_domain_model:contractFormation
					execution		ExecutionInstruction	0..1	Specifies instructions describing an execution primitive event.	common_domain_model:execution
					exercise		ExerciseInstruction	0..1	Specifies instructions describing an exercise primitive event.	common_domain_model:exercise
					partyChange		PartyChangeInstruction	0..1	Specifies instructions describing a party change primitive event.	common_domain_model:partyChange
					quantityChange		QuantityChangeInstruction	0..1	Specifies instructions describing an quantity change primitive event.	common_domain_model:quantityChange
					reset		ResetInstruction	0..1	Specifies instructions describing a reset event.	common_domain_model:reset
					split		SplitInstruction	0..1	Specifies instructions to split a trade into multiple branches.	common_domain_model:split
					termsChange		TermsChangeInstruction	0..1	Specifies instructions describing a terms change primitive event.	common_domain_model:termsChange
					transfer		TransferInstruction	0..1	Specifies instructions describing a transfer primitive event.	common_domain_model:transfer
					indexTransition		IndexTransitionInstruction	0..1	Specifies inputs needed to process a Index Transition business event.	common_domain_model:indexTransition
					stockSplit		StockSplitInstruction	0..1	Specifies inputs needed to process a Stock Split business event.	common_domain_model:stockSplit
					observation		ObservationInstruction	0..1	Specifies inputs needed to process an observation.	common_domain_model:observation
					valuation		ValuationInstruction	0..1	Specifies inputs needed to process an update of a valuation.	common_domain_model:valuation
PrincipalPayment		PrincipalPayment	Any kind of principal payments when the amount is known and thus fixed.							
					principalPaymentDate		AdjustableDate	0..1	The date where the PrincipalPayment shall be settled.	common_domain_model:principalPaymentDate
					payerReceiver	PrincipalPayment_payerReceiver	PayerReceiver	0..1	Specifies the parties responsible for making and receiving payments defined by this structure.	common_domain_model:payerReceiver
					principalAmount		Money	0..1	When known at the time the transaction is made, the cash amount to be paid.	common_domain_model:principalAmount
					discountFactor	PrincipalPayment_discountFactor	Decimal	0..1	The value representing the discount factor used to calculate the present value of the principal payment amount.	common_domain_model:discountFactor
					presentValuePrincipalAmount		Money	0..1	The amount representing the present value of the principal payment.	common_domain_model:presentValuePrincipalAmount
PrincipalPayments		PrincipalPayments	A class defining which principal exchanges occur for the stream.							
					initialPayment		Bool	1..1	A true/false flag to indicate whether there is an initial exchange of principal on the effective date.	common_domain_model:initialPayment
					finalPayment		Bool	1..1	A true/false flag to indicate whether there is a final exchange of principal on the termination date.	common_domain_model:finalPayment
					intermediatePayment		Bool	1..1	A true/false flag to indicate whether there are intermediate or interim exchanges of principal during the term of the swap.	common_domain_model:intermediatePayment
					varyingLegNotionalCurrency		str	0..*	Indicate the Payout legs which nominal amount may vary in regards of FX Fixing dates as determined in the product terms.	common_domain_model:varyingLegNotionalCurrency
					principalPaymentSchedule		PrincipalPaymentSchedule	0..1	Describe dates schedules for Principal Exchanges and related role of the parties when known.	common_domain_model:principalPaymentSchedule
PrincipalPaymentSchedule		PrincipalPaymentSchedule	Describe dates schedules for Principal Exchanges and related role of the parties when known.							
					initialPrincipalPayment		PrincipalPayment	0..1	Principal Payment made at Trade inception.	common_domain_model:initialPrincipalPayment
					intermediatePrincipalPayment		AdjustableRelativeOrPeriodicDates	0..1	Principal Payment as part of the Trade lifecycle e.g. as part of notional reset adjustements in a Cross Currency Swap with a varying notional leg.	common_domain_model:intermediatePrincipalPayment
					finalPrincipalPayment		PrincipalPayment	0..1	Principal Payment at Trade maturity	common_domain_model:finalPrincipalPayment
ProcessAgent		ProcessAgent	Specifies the Process Agent that might be appointed by the parties as part of a Credit Support Annex/Deed or Collateral Transfer Agreement.							
					partyElection	ProcessAgent_partyElection	ProcessAgentElection	1..*	The parties' Process Agent election.	common_domain_model:partyElection
ProcessAgentElection	ContactInformationElection	ProcessAgentElection	Specifies the parties' respective elections with respect to the Process Agent.							
					isApplicable	ProcessAgentElection_isApplicable	Bool	1..1	The qualification of whether the Process Agent is applicable (True) or not applicable (False).	common_domain_model:isApplicable
					entity		LegalEntity	0..1	Specification of the process agent entity.	common_domain_model:entity
					additionalInformation	ProcessAgentElection_additionalInformation	str	0..1	Additional information relating to the Process Agent.	common_domain_model:additionalInformation
Product		Product	Enables either a TransferableProduct or a NonTransferableProduct to be used in an underlier.							
ProductIdentifier		ProductIdentifier	Comprises an identifier and a source. The associated metadata key denotes the ability to associate a hash value to the ProductIdentifier instantiations for the purpose of model cross-referencing, in support of functionality such as the event effect and the lineage.							
					identifier	ProductIdentifier_identifier	str	1..*	Provides an identifier associated with a specific product.  The identifier is unique within the public source specified in the source attribute.	common_domain_model:identifier
					source		ProductIdTypeEnum	1..1	Defines the source of the identifier.	common_domain_model:source
ProductTaxonomy	Taxonomy	ProductTaxonomy	Specifies the product taxonomy, which is composed of a taxonomy value and a taxonomy source.							
					primaryAssetClass		AssetClassEnum	0..1	Classifies the most important risk class of the trade.	common_domain_model:primaryAssetClass
					secondaryAssetClass		AssetClassEnum	0..*	 Classifies additional risk classes of the trade, if any.	common_domain_model:secondaryAssetClass
					productQualifier		str	0..1	Derived from the product payout features using a CDM product qualification function that determines the product type based on the product payout features.	common_domain_model:productQualifier
ProtectionTerms		ProtectionTerms	A class to specify the terms for calculating a payout to protect the buyer of the swap in the case of a qualified credit event. These terms include the applicable credit events, the reference obligation, and in the case of a CDS on mortgage-backed securities, the floatingAmountEvents.							
					creditEvents	ProtectionTerms_creditEvents	CreditEvents	0..1	Specifies the applicable Credit Events that would trigger a settlement, as specified in the related Confirmation and defined in the ISDA 2014 Credit Definition article IV section 4.1.	common_domain_model:creditEvents
					obligations	ProtectionTerms_obligations	Obligations	1..1	The underlying obligations of the reference entity on which you are buying or selling protection. The credit events Failure to Pay, Obligation Acceleration, Obligation Default, Restructuring, Repudiation/Moratorium are defined with respect to these obligations.	common_domain_model:obligations
					floatingAmountEvents		FloatingAmountEvents	0..1	This element contains the ISDA terms relating to the floating rate payment events and the implied additional fixed payments, applicable to the credit derivatives transactions on mortgage-backed securities with pay-as-you-go or physical settlement.	common_domain_model:floatingAmountEvents
Prsn		Prsn								
					ctryOfBrnch		str	1..1		common_domain_model:ctryOfBrnch
					othr		Othr	1..1		common_domain_model:othr
PubliclyAvailableInformation		PubliclyAvailableInformation								
					standardPublicSources		Bool	0..1	If this element is specified and set to 'true', indicates that ISDA defined Standard Public Sources are applicable.	common_domain_model:standardPublicSources
					publicSource		str	0..*	A public information source, e.g. a particular newspaper or electronic news service, that may publish relevant information used in the determination of whether or not a credit event has occurred. ISDA 2003 Term: Public Source.	common_domain_model:publicSource
					specifiedNumber		int	0..1	The minimum number of the specified public information sources that must publish information that reasonably confirms that a credit event has occurred. The market convention is two. ISDA 2003 Term: Specified Number.	common_domain_model:specifiedNumber
Qty		Qty								
					unit	Qty_unit	str	1..1	Qualifies the unit by which the amount is measured. Optional because a measure may be unit-less (e.g. when representing a ratio between amounts in the same unit).	common_domain_model:unit
Quantity	QuantitySchedule	Quantity	Specifies a quantity as a single value to be associated to a financial product, for example a transfer amount resulting from a trade. This data type extends QuantitySchedule and requires that only the single amount value exists.							
QuantityChangeInstruction		QuantityChangeInstruction	Instructions required to create a Quantity Change Primitive Event, which can be either an increase, a decrease or a replacement. An increase adds a new trade lot to the original trade, whereas a decrease subtracts from an existing trade lot's quantity. A replacement updates the quantity of an existing trade lot to the new value.							
					change		PriceQuantity	1..*	Quantity by which the trade is being increased, decreased or replaced, and the price at which such quantity change is agreed. The quantity change should always be specified as a positive number, with the direction (increase/decrease/replacement) being specified by the direction enumeration. A fee can also be associated to the quantity change by specifying a Price component of type CashPrice, including the corresponding settlement date and direction.	common_domain_model:change
					direction		QuantityChangeDirectionEnum	1..1	Direction of the quantity change specified as either an increase, decrease or replacement.	common_domain_model:direction
					lotIdentifier	QuantityChangeInstruction_lotIdentifier	Identifier	0..*	Identifier for the new lot (in case of increase) or for the existing lot to be changed(in case of decrease or replacement). This optional attribute is mandatory in case of a decrease or replacement if the initial trade state contains multiple trade lots.	common_domain_model:lotIdentifier
QuantityMultiplier		QuantityMultiplier	 Class to specify a mechanism for a quantity to be set as a multiplier to another (reference) quantity, based on a price observation. At the moment this class only supports FX or Equity-linked notional and re-uses existing building blocks for those 2 cases, until such time when component can be made more generic. This captures the case of resetting cross-currency swaps and resetting equity swaps.							
					fxLinkedNotionalSchedule		FxLinkedNotionalSchedule	0..1	Multiplier specified as an FX-linked schedule, e.g. for a resetting cross-currency swap..	common_domain_model:fxLinkedNotionalSchedule
					multiplierValue		Decimal	0..1		common_domain_model:multiplierValue
QuantitySchedule	MeasureSchedule	QuantitySchedule	Specifies a quantity schedule to be associated to a financial product to represent a trade amount. This data type extends MeasureSchedule with several unit or multiplier attributes that are used to define financial quantities. This data type is generically based on a schedule and can also be used to represent a quantity as a single value.							
					multiplier		Measure	0..1	Defines an optional number that the quantity should be multiplied by to derive a total quantity. This number is associated to a unit. For example in the case of the Coal (API2) CIF ARA (ARGUS-McCloskey) Futures Contract on the CME, where the unit would be contracts, the multiplier value would 1,000 and the mulitiplier unit would be 1,000 MT (Metric Tons).	common_domain_model:multiplier
					frequency		Frequency	0..1	Defines the frequency to be used when defining a quantity. For example a quantity may be specified as a number of barrels of oil per day, which needs multiplying by the number of days in the relevant period to get the total quantity as a number of barrels.	common_domain_model:frequency
Quanto		Quanto	Determines the currency rate that the seller of the equity amounts will apply at each valuation date for converting the respective amounts into a currency that is different from the currency denomination of the underlier.							
					fxRate		FxRate	0..*	Specifies a currency conversion rate.	common_domain_model:fxRate
					fxSpotRateSource	Quanto_fxSpotRateSource	FxSpotRateSource	1..1	Specifies the methodology (reference source and, optionally, fixing time) to be used for determining a currency conversion rate.	common_domain_model:fxSpotRateSource
					fixingTime	Quanto_fixingTime	BusinessCenterTime	0..1	The time at which the spot currency exchange rate will be observed. It is specified as a time in a business day calendar location, e.g. 11:00am London time.	common_domain_model:fixingTime
QuasiGovernmentIssuerType		QuasiGovernmentIssuerType	Represents a class to allow specification of different types of Quasi Government collateral.							
					sovereignEntity		Bool	1..1	True if sovereign entity (e.g. not separate legal personality from sovereign) or false if non-sovereign entity (e.g. separate legal personality from sovereign).	common_domain_model:sovereignEntity
					sovereignRecourse		Bool	0..1	Applies to non-sovereign entity (e.g. separate legal personality from sovereign).  True if entity has recourse to sovereign (e.g. debt guaranteed by government).  False if entity does not have recourse to sovereign.	common_domain_model:sovereignRecourse
QuotedCurrencyPair		QuotedCurrencyPair	A class that describes the composition of a rate that has been quoted or is to be quoted. This includes the two currencies and the quotation relationship between the two currencies and is used as a building block throughout the FX specification.							
					currency1		str	1..1	The first currency specified when a pair of currencies is to be evaluated.	common_domain_model:currency1
					currency2		str	1..1	The second currency specified when a pair of currencies is to be evaluated.	common_domain_model:currency2
					quoteBasis		QuoteBasisEnum	1..1	The method by which the exchange rate is quoted.	common_domain_model:quoteBasis
RateObservation		RateObservation	A class defining parameters associated with an individual observation or fixing. This class forms part of the cashflow representation of a stream.							
					resetDate	RateObservation_resetDate	XSDDate	1..1	The reset date.	common_domain_model:resetDate
					adjustedFixingDate		XSDDate	0..1	The adjusted fixing date, i.e. the actual date the rate is observed. The date should already be adjusted for any applicable business day convention.	common_domain_model:adjustedFixingDate
					observedRate		Decimal	0..1	The actual observed rate before any required rate treatment is applied, e.g. before converting a rate quoted on a discount basis to an equivalent yield. An observed rate of 5% would be represented as 0.05.	common_domain_model:observedRate
					treatedRate		Decimal	0..1	The observed rate after any required rate treatment is applied. A treated rate of 5% would be represented as 0.05.	common_domain_model:treatedRate
					observationWeight		int	0..1	The number of days weighting to be associated with the rate observation, i.e. the number of days such rate is in effect. This is applicable in the case of a weighted average method of calculation where more than one reset date is established for a single calculation period.	common_domain_model:observationWeight
					rateReference		RateObservation	0..1	A pointer style reference to a floating rate component defined as part of a stub calculation period amount component. It is only required when it is necessary to distinguish two rate observations for the same fixing date which could occur when linear interpolation of two different rates occurs for a stub calculation period.	common_domain_model:rateReference
					forecastRate		Decimal	0..1	The value representing the forecast rate used to calculate the forecast future value of the accrual period.A value of 1% should be represented as 0.01.	common_domain_model:forecastRate
					treatedForecastRate		Decimal	0..1	The value representing the forecast rate after applying rate treatment rules. A value of 1% should be represented as 0.01.	common_domain_model:treatedForecastRate
RateSchedule		RateSchedule	A class defining a schedule of rates or amounts in terms of an initial value and then a series of step date and value pairs. On each step date the rate or amount changes to the new step value. The series of step date and value pairs are optional. If not specified, this implies that the initial value remains unchanged over time.							
					price	RateSchedule_price	PriceSchedule	1..1	The initial rate. An initial rate of 5% would be represented as 0.05.	common_domain_model:price
RateSpecification		RateSpecification	 A data type to specify the fixed interest rate, floating interest rate or inflation rate.							
RatingAgencyAmount		RatingAgencyAmount	A logical container to hold a defined set of related data. In this case the collation of Rating Information and an associated Independent Amount.							
					ratingVariableSet		CreditNotation	1..*	Allows a grouping of Rating agencies and Rating values.	common_domain_model:ratingVariableSet
					amount	RatingAgencyAmount_amount	Decimal	1..1	Specifies the notional or collateral Independent Amount.	common_domain_model:amount
RatingAgencyValue	CreditNotation	RatingAgencyValue	A logical container designed to hold a set of related data. In this case the Rating Agency, Rating Value and Rating Type.							
					ratingType		RatingTypeEnum	1..1	The relevant rating type.	common_domain_model:ratingType
RatingMultiplier		RatingMultiplier	A logical container to hold a defined set of related data. In this case the collation of Ratings Information and associated exposure multiplier.							
					ratingVariableSet		CreditNotation	1..*	Allows a grouping of Rating agencies and Rating values.	common_domain_model:ratingVariableSet
					exposureMultiplier		Decimal	1..1	Specifies the multiplier applied to exposure based on the credit rating of the rated party.	common_domain_model:exposureMultiplier
RecalculationOfValue		RecalculationOfValue	A class to specify terms for Recalculation of the Market Value of Posted Collateral when a dispute has been failed to be resolved by Resolution Time.							
					partyElection	RecalculationOfValue_partyElection	RecalculationOfValueElection	1..*	The parties' Recalculation of Value terms.	common_domain_model:partyElection
RecalculationOfValueElection		RecalculationOfValueElection	A class to specify Recalculation of Value terms that will be applicable.							
					party	RecalculationOfValueElection_party	CounterpartyRoleEnum	1..1	The elective party.	common_domain_model:party
					recalculationOfValueElection		RecalculationOfValueElectionEnum	1..1	The procedure for Recalculation of Value.	common_domain_model:recalculationOfValueElection
					recalculationOfValueTerms		str	0..1	Additional Recalculation of Value terms when specified.	common_domain_model:recalculationOfValueTerms
RecallProvision		RecallProvision	Defines the additional features that allow securities to be recalled by the lender before the term of the loan. A recall is not the same as an early termination, but may result in the early termination of a loan.							
					isRecallable		Bool	1..1	Whether the securities on loan can be recalled by the lender.	common_domain_model:isRecallable
					issuanceCutoffTime		TimeZone	0..1	The operational deadline on T+0 before which a recall must be requested. For the UK, best practice recommends that this would be 30 minutes before market close i.e. 16:00:00 GMT.	common_domain_model:issuanceCutoffTime
					notificationTime	RecallProvision_notificationTime	TimeZone	1..1	The time on the day of intended settlement by which the borrower must notify the lender that they will be returning the requested security. For the UK, best practice recommends that this would be 30 minutes before the CREST DVP cut-off time i.e. 15:15:00 GMT	common_domain_model:notificationTime
