Class Name	Parent Class	YAML Class Name	Description	Flags	Slot Name	YAML Slot Name	Range	Card	Slot Description	URI
IdentifiedList		IdentifiedList	Attaches an identifier to a collection of objects, when those objects themselves can each be represented by an identifier. One use case is the representation of package transactions, where each component is a separate trade with its own identifier, and those trades are linked together as a package with its own identifier. The data type has been named generically rather than referring to 'packages' as it may have a number of other uses.							
					listId		Identifier	1..1	The identifier for the list. In the case of a package transaction, this would be the package identifier. This attribute is mandatory to allow the list itself to be identified.	common_domain_model:listId
					componentId		Identifier	1..*	Identifiers for each component of the list. Since the data type is used to link multiple identified objects together, at least 2 components are required in the list. Creating an identified list with only 1 identified component has been deemed unnecessary, because it would just create a redundant identifier.	common_domain_model:componentId
					price		Price	0..1	The price of the package.	common_domain_model:price
Identifier		Identifier	A class to specify a generic identifier, applicable to CDM artefacts such as executions, contracts, lifecycle events and legal documents. An issuer can be associated with the actual identifier value as a way to properly qualify it.							
					issuerReference		Party	0..1	The identifier issuer, when specified by reference to a party specified as part of the transaction.	common_domain_model:issuerReference
					issuer		str	0..1	The identifier issuer, when specified explicitly alongside the identifier value (instead of being specified by reference to a party).	common_domain_model:issuer
					assignedIdentifier		AssignedIdentifier	1..*	The identifier value. This level of indirection between the issuer and the identifier and its version provides the ability to associate multiple identifiers to one issuer, consistently with the FpML PartyTradeIdentifier.	common_domain_model:assignedIdentifier
Illiquidity		Illiquidity								
					illiquidityIsApplicable		Bool	1..1		common_domain_model:illiquidityIsApplicable
					escrowArrangement		EscrowArrangement	0..1		common_domain_model:escrowArrangement
					minimumAmount		Quantity	0..1		common_domain_model:minimumAmount
					fallbackReferencePrice		SettlementRateOption	0..1	The method, prioritised by the order it is listed in this element, to get a replacement rate for the disrupted settlement rate option.	common_domain_model:fallbackReferencePrice
					illiquidityValuationDate		AdjustedRelativeDateOffset	0..1		common_domain_model:illiquidityValuationDate
IndependentAmount	PartyReferencePayerReceiver	IndependentAmount	A class specifying the Independent Amount as the combination of a payer/receiver, a payment amount, a payment date and an associated payment calculation rule.							
					paymentDetail		PaymentDetail	1..*	An attribute that specifies a payment as the combination of a payment amount, a payment date and an associated payment calculation rule.	common_domain_model:paymentDetail
IndependentAmountRatings		IndependentAmountRatings	A logical container designed to hold a set of related data. In this case, designed to hold a set of information required when Independent Amount is determined using credit ratings.							
					compare	IndependentAmountRatings_compare	IndependentAmountCompareEnum	1..1	Specifies how multiple credit ratings are compared when determining the applicable Independent Amount, and whether that measure is highest, lowest, or a comparison of either.	common_domain_model:compare
					ratedParty	IndependentAmountRatings_ratedParty	RatedPartyEnum	1..1	Specifies the party to whom the rating agency rating applies to for the purposes of determining the Independent Amount.	common_domain_model:ratedParty
					namedAffiliate	IndependentAmountRatings_namedAffiliate	LegalEntity	0..1	Details the Named Affiliate where the Rated Party is Named Affiliate.	common_domain_model:namedAffiliate
					namedEntity	IndependentAmountRatings_namedEntity	LegalEntity	0..1	Details the Named Entity where the Rated Party is Named Entity.	common_domain_model:namedEntity
					ratingType		RatingTypeEnum	1..1	The relevant rating type.	common_domain_model:ratingType
Index		Index	An Index is an Observable which is computed based on the prices, rates or valuations of a number of assets that are tracked in a standardized way.  Examples include equity market indices as well as indices on interest rates, inflation and credit instruments.							
IndexAdjustmentEvents		IndexAdjustmentEvents	Defines the specification of the consequences of Index Events							
					indexModification		IndexEventConsequenceEnum	1..1	Consequence of index modification.	common_domain_model:indexModification
					indexCancellation		IndexEventConsequenceEnum	1..1	Consequence of index cancellation.	common_domain_model:indexCancellation
					indexDisruption		IndexEventConsequenceEnum	1..1	Consequence of index disruption.	common_domain_model:indexDisruption
IndexBase	AssetBase	IndexBase	Identifies an index by referencing an identifier.							
					name	IndexBase_name	str	0..1	A description of the Index.	common_domain_model:name
					provider		LegalEntity	0..1	The organisation that creates or maintains the Index.	common_domain_model:provider
					assetClass	IndexBase_assetClass	AssetClassEnum	1..1	The Asset Class of the Index.	common_domain_model:assetClass
IndexTransitionInstruction		IndexTransitionInstruction	Defines the information needed to create a Index Transition Business Event.							
					priceQuantity	IndexTransitionInstruction_priceQuantity	PriceQuantity	1..*	Specifies both new floating rate index and spread adjustment for each leg to be updated.  The spread adjustment accounts for the difference between the old floating rate index relative to the new one. This spread amount is added to the existing spread to determine the new spread, which is applied from the specified effective date forward. In the case of the IBOR Fallback Rate Adjustments, the adjustment spread (also known as the Fallback Adjustment) accounts for two distinctions: i) the fact that the replacement Risk-Free Rate is an overnight rate while IBORs have term structures (e.g., 1, 3, 6-month LIBOR); and (ii) the historical spread differential between IBORs and their term equivalent Overnight Risk-Free Rate compounded rates.	common_domain_model:priceQuantity
					effectiveDate	IndexTransitionInstruction_effectiveDate	XSDDate	1..1	Specifies the effective date of the index transition event. This is first date on which the floating rate calculation will use the new floating rate index and adjusted spread in the floating rate calculation.	common_domain_model:effectiveDate
					cashTransfer		Transfer	0..1	Specifies the cash transfer that can optionally be tied to an index transition event.	common_domain_model:cashTransfer
IndexType		IndexType	Specification of an index.							
					equityIndex		CollateralEquityIndexEnum	0..1	An enumerated list for equity indices.	common_domain_model:equityIndex
Indx		Indx								
					nm	Indx_nm	Nm	1..1		common_domain_model:nm
IneligibleCreditSupport		IneligibleCreditSupport	Identifies collateral that has been designated as not meeting the eligibility criteria set out in the agreement.							
					totalIneligibilityDate		str	0..1	Specifies the date from which all credit support provided by a party is treated as ineligible under the agreement.	common_domain_model:totalIneligibilityDate
					transferIneligibilityDate		str	0..1	Specifies the date from which the transfer of credit support by a party is treated as ineligible under the agreement.	common_domain_model:transferIneligibilityDate
					specifiedParty		CounterpartyRoleEnum	0..*	Identifies a party designated in the agreement for the purpose of applying particular rights, obligations, or elections.	common_domain_model:specifiedParty
InflationIndex	IndexBase	InflationIndex	Specification of an index that measures inflation in a specific market, e.g. the US Consumer Price Index.							
					inflationRateIndex		InflationRateIndexEnum	1..1	The reference index that is used to specify the inflation interest rate.	common_domain_model:inflationRateIndex
					indexTenor		Period	0..1	The ISDA Designated Maturity, i.e. the floating rate tenor.	common_domain_model:indexTenor
InflationRateSpecification	FloatingRateSpecification	InflationRateSpecification	A data to:  specify the inflation rate.							
					inflationLag		Offset	1..1	An off-setting period from the payment date which determines the reference period for which the inflation index is observed.	common_domain_model:inflationLag
					indexSource		str	1..1	The reference source such as Reuters or Bloomberg. FpML specifies indexSource to be of type rateSourcePageScheme, but without specifying actual values.	common_domain_model:indexSource
					mainPublication		str	1..1	The current main publication source such as relevant web site or a government body. FpML specifies mainPublication to be of type mainPublicationSource, but without specifying actual values.	common_domain_model:mainPublication
					interpolationMethod	InflationRateSpecification_interpolationMethod	InterpolationMethodEnum	1..1	The method used when calculating the Inflation Index Level from multiple points. The most common is Linear.	common_domain_model:interpolationMethod
					initialIndexLevel		Decimal	0..1	Initial known index level for the first calculation period.	common_domain_model:initialIndexLevel
					fallbackBondApplicable		Bool	1..1	The applicability of a fallback bond as defined in the 2006 ISDA Inflation Derivatives Definitions, sections 1.3 and 1.8.	common_domain_model:fallbackBondApplicable
					calculationMethod	InflationRateSpecification_calculationMethod	InflationCalculationMethodEnum	1..1	Indicates how to use the inflation index to calculate the payment (e.g. Ratio, Return, Spread). Added for Inflation Asset Swap	common_domain_model:calculationMethod
					calculationStyle		InflationCalculationStyleEnum	0..1	Indicates the style of how the inflation index calculates the payment (e.g. YearOnYear, ZeroCoupon).	common_domain_model:calculationStyle
					finalPrincipalExchangeCalculation		FinalPrincipalExchangeCalculationEnum	0..1	To be specified only for products that embed a redemption payment.	common_domain_model:finalPrincipalExchangeCalculation
InformationSource		InformationSource	A class defining the source for a piece of information (e.g. a rate fix or an FX fixing). The attribute names have been adjusted from FpML to address the fact that the information is not limited to rates.							
					sourceProvider		InformationProviderEnum	1..1	An information source for obtaining a market data point. For example Bloomberg, Reuters, Telerate, etc.	common_domain_model:sourceProvider
					sourcePage		str	0..1	A specific page for the source for obtaining a market data point. In FpML, this is specified as a scheme, rateSourcePageScheme, for which no coding Scheme or URI is specified.	common_domain_model:sourcePage
					sourcePageHeading		str	0..1	The heading for the source on a given source page.	common_domain_model:sourcePageHeading
InitialFixingDate		InitialFixingDate	A CDM class which purpose is to specify the initial fixing date either alongside the FpML interest rate specification as an offset of another date, or alongside the credit derivative specification as an unadjusted date.							
					relativeDateOffset		RelativeDateOffset	0..1		common_domain_model:relativeDateOffset
					initialFixingDate	InitialFixingDate_initialFixingDate	XSDDate	0..1	The initial fixing date.	common_domain_model:initialFixingDate
Instruction		Instruction	Instruction to a function that will be used to perform a business event							
					primitiveInstruction		PrimitiveInstruction	0..1	Specifies the primitive instructions that will be used to call primitive event functions.	common_domain_model:primitiveInstruction
					before		TradeState	0..1	Specifies the trade state that will be acted on by the primitive event functions.	common_domain_model:before
Instrument		Instrument	A type of Asset that is issued by one party to one or more others.							
InstrumentBase	AssetBase	InstrumentBase	Defines the common attributes for all Instrument data types.							
InterestAdjustment		InterestAdjustment	A class to specify whether the Interest Adjustment is applicable and what its periodicity is.							
					isApplicable	InterestAdjustment_isApplicable	Bool	1..1	The Interest Adjustment is applicable when True and not applicable when False.	common_domain_model:isApplicable
					periodicity		InterestAdjustmentPeriodicity	1..1	The qualification of the Interest Adjustment periodicity.	common_domain_model:periodicity
InterestAdjustmentPeriodicity		InterestAdjustmentPeriodicity	A class to specify the Interest Adjustment periodicity.							
					standardElection		InterestAdjustmentPeriodicityEnum	0..1	The Interest Adjustment periodicity when specified through a standardized election.	common_domain_model:standardElection
					customElection	InterestAdjustmentPeriodicity_customElection	str	0..1	The Interest Adjustment periodicity when specified through a custom election.	common_domain_model:customElection
InterestAmount		InterestAmount	A class to specify the application of Interest Amount with respect to the Delivery Amount and the Return Amount.							
					returnAmount	InterestAmount_returnAmount	ReturnAmount	1..1	The application of Interest Amount with respect the Return Amount.	common_domain_model:returnAmount
					deliveryAmount	InterestAmount_deliveryAmount	DeliveryAmount	1..1	The application of Interest Amount with respect the Delivery Amount.	common_domain_model:deliveryAmount
InterestAmountApplication		InterestAmountApplication	A class to specify the application of Interest Amount with respect to the Delivery Amount and the Return Amount.							
					returnAmount	InterestAmountApplication_returnAmount	ReturnAmount	1..1	The application of Interest Amount with respect the Return Amount.	common_domain_model:returnAmount
					deliveryAmount	InterestAmountApplication_deliveryAmount	DeliveryAmount	1..1	The application of Interest Amount with respect the Delivery Amount.	common_domain_model:deliveryAmount
InterestRateCurve		InterestRateCurve								
					floatingRateIndex		FloatingRateIndexEnum	1..1	The reference index that is used to specify the floating interest rate.	common_domain_model:floatingRateIndex
					tenor		Period	1..1		common_domain_model:tenor
InterestRateIndex		InterestRateIndex	An index based in interest rates or inflation rates in a certain market.							
InterestRatePayout	PayoutBase	InterestRatePayout	 A class to specify all of the terms necessary to define and calculate a cash flow based on a fixed, a floating or an inflation index rate. The interest rate payout can be applied to interest rate swaps and FRA (which both have two associated interest rate payouts), credit default swaps (to represent the fee leg when subject to periodic payments) and equity swaps (to represent the funding leg). The associated globalKey denotes the ability to associate a hash value to the InterestRatePayout instantiations for the purpose of model cross-referencing, in support of functionality such as the event effect and the lineage.							
					rateSpecification		RateSpecification	0..1	The specification of the rate value(s) applicable to the contract using either a floating rate calculation, a single fixed rate, a fixed rate schedule, or an inflation rate calculation.	common_domain_model:rateSpecification
					dayCountFraction	InterestRatePayout_dayCountFraction	DayCountFractionEnum	1..1	The day count fraction. The cardinality has been relaxed when compared with the FpML interest rate swap for the purpose of accommodating standardized credit default swaps which DCF is not explicitly stated as part of the economic terms. The data rule InterestRatePayout_dayCountFraction requires that the DCF be stated for interest rate products.	common_domain_model:dayCountFraction
					calculationPeriodDates	InterestRatePayout_calculationPeriodDates	CalculationPeriodDates	0..1	The parameters used to generate the calculation period dates schedule, including the specification of any initial or final stub calculation periods.	common_domain_model:calculationPeriodDates
					paymentDates	InterestRatePayout_paymentDates	PaymentDates	1..1	The payment date schedule, as defined by the parameters that are needed to specify it, either in a parametric way or by reference to another schedule of dates (e.g. the reset dates).	common_domain_model:paymentDates
					paymentDate	InterestRatePayout_paymentDate	AdjustableDate	0..1	The payment date, where only one date is specified, as for the FRA product.	common_domain_model:paymentDate
					paymentDelay		Bool	0..1	Applicable to CDS on MBS to specify whether payment delays are applicable to the fixed Amount. RMBS typically have a payment delay of 5 days between the coupon date of the reference obligation and the payment date of the synthetic swap. CMBS do not, on the other hand, with both payment dates being on the 25th of each month.	common_domain_model:paymentDelay
					resetDates		ResetDates	0..1	The reset dates schedule, i.e. the dates on which the new observed index value is applied for each period and the interest rate hence begins to accrue.	common_domain_model:resetDates
					discountingMethod		DiscountingMethod	0..1	The parameters specifying any discounting conventions that may apply. This element must only be included if discounting applies.	common_domain_model:discountingMethod
					compoundingMethod		CompoundingMethodEnum	0..1	If one or more calculation period contributes to a single payment amount this element specifies whether compounding is applicable and, if so, what compounding method is to be used. This element must only be included when more than one calculation period contributes to a single payment amount.	common_domain_model:compoundingMethod
					cashflowRepresentation		CashflowRepresentation	0..1	The cashflow representation of the swap stream.	common_domain_model:cashflowRepresentation
					stubPeriod		StubPeriod	0..1	The stub calculation period amount parameters. This element must only be included if there is an initial or final stub calculation period. Even then, it must only be included if either the stub references a different floating rate tenor to the regular calculation periods, or if the stub is calculated as a linear interpolation of two different floating rate tenors, or if a specific stub rate or stub amount has been negotiated.	common_domain_model:stubPeriod
					bondReference		BondReference	0..1	Reference to a bond underlier to represent an asset swap or Condition Precedent Bond.	common_domain_model:bondReference
					fixedAmount	InterestRatePayout_fixedAmount	str	0..1	Fixed Amount Calculation	common_domain_model:fixedAmount
					floatingAmount		str	0..1	Floating Amount Calculation	common_domain_model:floatingAmount
					spreadCalculationMethod		SpreadCalculationMethodEnum	0..1	Method by which spread is calculated. For example on an asset swap: 'ParPar' or 'Proceeds' may be the method indicated.	common_domain_model:spreadCalculationMethod
InterestShortFall		InterestShortFall	A class to specify the interest shortfall floating rate payment event.							
					interestShortfallCap		InterestShortfallCapEnum	1..1	Specifies the nature of the interest Shortfall cap (i.e. Fixed Cap or Variable Cap) in the case where it is applicable. ISDA 2003 Term: Interest Shortfall Cap.	common_domain_model:interestShortfallCap
					compounding		Bool	1..1		common_domain_model:compounding
					rateSource		FloatingRateIndexEnum	0..1	The rate source in the case of a variable cap.	common_domain_model:rateSource
Inventory		Inventory	A data type that can be used to describe an inventory of securities.							
					inventoryRecord		InventoryRecord	0..*	An array holding the list of inventory being described. Each element in the inventoryRecord array represents an individual piece of inventory i.e. a security.	common_domain_model:inventoryRecord
InventoryRecord		InventoryRecord	An individual piece of inventory. This represents a single security.							
					identifer		AssignedIdentifier	1..1	Unique identifier for this record. This can be used to uniquely identify a specific piece of inventory.	common_domain_model:identifer
					security		Security	1..1	The security details.	common_domain_model:security
InvstmtDcsnPrsn		InvstmtDcsnPrsn								
					prsn		Prsn	1..1		common_domain_model:prsn
IssuerAgencyRating		IssuerAgencyRating								
					issuerAgencyRating		AgencyRatingCriteria	1..1	Represents an agency rating based on default risk and creditors claim in event of default associated with asset issuer.	common_domain_model:issuerAgencyRating
IssuerCountryOfOrigin		IssuerCountryOfOrigin								
					issuerCountryOfOrigin		ISOCountryCodeEnum	1..1	Represents a filter on the issuing entity country of origin based on the ISO Standard 3166, which is the same as filtering by eligible Sovereigns.	common_domain_model:issuerCountryOfOrigin
IssuerName		IssuerName								
					issuerName		LegalEntity	1..1	Specifies the issuing entity name or LEI.	common_domain_model:issuerName
JapaneseSecuritiesProvisions		JapaneseSecuritiesProvisions	A class to specify Japanese Securities Provision elections.							
					isApplicable	JapaneseSecuritiesProvisions_isApplicable	Bool	1..1	Japanese Securities Provisions are applicable when True and Not Applicable when False.	common_domain_model:isApplicable
					relevantProvisionsElection		Bool	0..1	Recommended Japanese Securities Provisions are applicable when True, additional Provisions are specified when False.	common_domain_model:relevantProvisionsElection
					relevantProvisionsTerms		str	0..1	Specific terms applicable to Recommended Japanese Securities Provisions.	common_domain_model:relevantProvisionsTerms
					amendmentsToJapaneseProvisions		Bool	0..1	Additional Amendments to Japanese Securities Provisions are specified when True, and not specified when False.	common_domain_model:amendmentsToJapaneseProvisions
					amendmentsToJapaneseProvisionsTerms		str	0..1	Specific terms applicable to Additional Amendments to Japanese Securities Provisions.	common_domain_model:amendmentsToJapaneseProvisionsTerms
					clearstreamAmendmentToJapaneseProvisions		Bool	0..1	Specification of whether Clearstream Event amendment language is included (true) or excluded (false).	common_domain_model:clearstreamAmendmentToJapaneseProvisions
JurisdictionRelatedTerms		JurisdictionRelatedTerms	A class to specify terms jurisdiction related terms.							
					japaneseSecuritiesProvisions		JapaneseSecuritiesProvisions	0..1	The Japanese Securities Provisions election.	common_domain_model:japaneseSecuritiesProvisions
					exclusiveJurisdiction		Bool	0..1	Classification of optional exclusive jurisdiction terms.	common_domain_model:exclusiveJurisdiction
					juryWaiver		Bool	0..1	The Jury Waiver conditions specific to the agreement.	common_domain_model:juryWaiver
					frenchLawAddendum		FrenchLawAddendum	0..1	The French Law Addendum Provisions specific to the agreement.	common_domain_model:frenchLawAddendum
					belgianLawSecurityAgreement		Bool	0..1	The qualification of whether the Belgian Law Security Agreement Addendum is deemed applicable by the parties (True) or not (False).	common_domain_model:belgianLawSecurityAgreement
Lag		Lag	The pricing period per calculation period if the pricing days do not wholly fall within the respective calculation period.							
					lagDuration		Offset	1..1	Defines the offset of the series of pricing dates relative to the calculation period.	common_domain_model:lagDuration
					firstObservationDateOffset		Offset	0..1	Defines the offset of the series of pricing dates relative to the calculation period.	common_domain_model:firstObservationDateOffset
LegacyExposureScopeElection		LegacyExposureScopeElection	Specification of amendments to the calculation of Exposure in terms of the Transactions and Products covered.							
					party	LegacyExposureScopeElection_party	CounterpartyRoleEnum	1..1	The elective party.	common_domain_model:party
					excludedTransactions		Bool	1..1	A boolean flag to represent whether any transactions are excluded (ie True) or not (ie False).	common_domain_model:excludedTransactions
					excludedProducts		ExcludedProducts	0..*	Description of the relevant derivative transactions excluded from the calculation of exposure.	common_domain_model:excludedProducts
					additionalLanguage	LegacyExposureScopeElection_additionalLanguage	str	0..1	The bespoke/additional language that might be specified by the parties to the legal agreement.	common_domain_model:additionalLanguage
LegacyIndependentAmount		LegacyIndependentAmount	Sets out the additional amount of collateral that is required to be delivered by that party irrespective of the mark-to-market exposure under the related Transactions. It may take the form of a fixed amount, or be determined using credit ratings.							
					partyElection	LegacyIndependentAmount_partyElection	LegacyIndependentAmountParty	1..*	The party specific elections for the Independent Amount clause.	common_domain_model:partyElection
					additionalLanguage	LegacyIndependentAmount_additionalLanguage	str	0..1	The additional language that might be specified by the parties to the legal agreement.	common_domain_model:additionalLanguage
LegacyIndependentAmountParty		LegacyIndependentAmountParty	The party specific elections for the Independent Amount clause.							
